{
  "schema_version": 1,
  "run_id": "2026-09-04-mts-test-data",
  "generation": {
    "mode": "agent",
    "agent": "Codex",
    "model": "GPT-5",
    "model_version": "unknown"
  },
  "summary": "Проверены все три примера: поток геолокации, поток CDR и ежемесячная витрина-агрегат. Сформулировано 16 вопросов до передачи в разработку: 12 высокого и 4 среднего приоритета. Основные риски связаны с отсутствующей трассировкой полей и обязательных параметров источников, не до конца определённой временной логикой, противоречивой fallback-логикой региона, недетерминированным выбором последних записей и неясной семантикой обновления. Статус всех замечаний — unreviewed: решение об изменении ТЗ принимает человек.",
  "coverage": {
    "reviewed_fragment_ids": [
      "s001-p0001-text",
      "s001-p0002-text",
      "s001-p0003-text",
      "s001-p0003-t001-r001",
      "s001-p0003-t001-r002",
      "s001-p0003-t001-r003",
      "s001-p0003-t001-r004",
      "s001-p0003-t001-r005",
      "s001-p0003-t001-r006",
      "s001-p0003-t001-r007",
      "s001-p0003-t001-r008",
      "s001-p0003-t002-r001",
      "s001-p0003-t002-r002",
      "s001-p0003-t002-r003",
      "s001-p0003-t002-r004",
      "s001-p0003-t002-r005",
      "s001-p0003-t002-r006",
      "s001-p0003-t003-r001",
      "s001-p0003-t003-r002",
      "s001-p0003-t003-r003",
      "s001-p0003-t003-r004",
      "s001-p0003-t003-r005",
      "s001-p0003-t003-r006",
      "s001-p0003-t003-r007",
      "s001-p0003-t003-r008",
      "s001-p0003-t003-r009",
      "s001-p0003-t003-r010",
      "s001-p0003-t003-r011",
      "s001-p0003-t003-r012",
      "s001-p0003-t003-r013",
      "s001-p0003-t003-r014",
      "s001-p0003-t003-r015",
      "s001-p0003-t003-r016",
      "s001-p0003-t004-r001",
      "s001-p0003-t004-r002",
      "s001-p0003-t004-r003",
      "s001-p0003-t004-r004",
      "s001-p0003-t004-r005",
      "s001-p0003-t004-r006",
      "s001-p0004-text",
      "s001-p0004-t001-r001",
      "s001-p0004-t001-r002",
      "s001-p0004-t001-r003",
      "s001-p0004-t001-r004",
      "s001-p0004-t001-r005",
      "s001-p0004-t001-r006",
      "s001-p0004-t001-r007",
      "s001-p0004-t001-r008",
      "s001-p0004-t001-r009",
      "s001-p0005-text",
      "s001-p0005-t001-r001",
      "s001-p0005-t001-r002",
      "s001-p0005-t001-r003",
      "s001-p0005-t001-r004",
      "s001-p0005-t001-r005",
      "s001-p0005-t001-r006",
      "s001-p0005-t001-r007",
      "s001-p0006-text",
      "s001-p0006-t001-r001",
      "s001-p0006-t001-r002",
      "s001-p0006-t001-r003",
      "s001-p0006-t001-r004",
      "s001-p0006-t001-r005",
      "s001-p0006-t001-r006",
      "s001-p0006-t001-r007",
      "s001-p0006-t001-r008",
      "s001-p0006-t001-r009",
      "s001-p0006-t001-r010",
      "s001-p0006-t001-r011",
      "s001-p0006-t001-r012",
      "s001-p0006-t001-r013",
      "s001-p0006-t001-r014",
      "s001-p0006-t001-r015",
      "s001-p0006-t001-r016",
      "s001-p0007-text",
      "s001-p0007-t001-r001",
      "s001-p0007-t001-r002",
      "s001-p0007-t001-r003",
      "s001-p0007-t001-r004",
      "s001-p0007-t001-r005",
      "s001-p0007-t001-r006",
      "s001-p0008-text",
      "s001-p0008-t001-r001",
      "s001-p0008-t001-r002",
      "s001-p0008-t001-r003",
      "s001-p0008-t001-r004",
      "s001-p0008-t001-r005",
      "s001-p0008-t001-r006",
      "s001-p0009-text",
      "s001-p0009-t001-r001",
      "s001-p0009-t001-r002",
      "s001-p0009-t001-r003",
      "s001-p0009-t001-r004",
      "s001-p0009-t001-r005",
      "s001-p0009-t001-r006",
      "s001-p0009-t001-r007",
      "s001-p0009-t001-r008",
      "s002-p0001-text",
      "s003-p0001-text",
      "s003-p0001-t001-r001",
      "s003-p0001-t001-r002",
      "s003-p0001-t001-r003",
      "s003-p0001-t001-r004",
      "s003-p0001-t001-r005",
      "s003-p0001-t001-r006",
      "s003-p0001-t001-r007",
      "s003-p0001-t001-r008",
      "s003-p0001-t001-r009",
      "s003-p0001-t001-r010",
      "s003-p0001-t001-r011",
      "s003-p0001-t002-r002",
      "s003-p0001-t002-r003",
      "s003-p0001-t003-r002",
      "s003-p0001-t003-r003",
      "s003-p0001-t004-r002",
      "s003-p0001-t005-r001",
      "s003-p0001-t005-r002",
      "s003-p0001-t005-r003",
      "s003-p0001-t005-r004",
      "s003-p0001-t005-r005",
      "s003-p0001-t005-r006",
      "s003-p0002-text",
      "s003-p0002-t001-r001",
      "s003-p0002-t001-r002",
      "s003-p0002-t001-r003",
      "s003-p0002-t001-r004",
      "s003-p0002-t001-r005",
      "s003-p0002-t001-r007",
      "s003-p0002-t001-r010",
      "s003-p0002-t001-r011",
      "s003-p0002-t002-r002",
      "s003-p0002-t003-r001",
      "s003-p0002-t003-r002",
      "s003-p0002-t003-r003",
      "s003-p0002-t003-r004",
      "s003-p0002-t003-r005",
      "s003-p0002-t003-r006",
      "s003-p0002-t003-r007",
      "s004-b0001",
      "s004-b0002",
      "s004-b0003",
      "s004-b0004",
      "s004-b0005",
      "s004-b0006",
      "s004-b0007",
      "s004-b0008",
      "s004-b0009",
      "s004-b0010",
      "s004-b0011",
      "s004-b0012",
      "s004-b0013",
      "s004-b0014",
      "s004-b0015",
      "s004-b0016",
      "s004-b0017",
      "s004-b0018",
      "s004-b0019",
      "s004-b0020",
      "s004-b0021",
      "s004-b0022",
      "s005-b0001",
      "s005-b0002",
      "s005-b0003",
      "s005-b0004",
      "s005-b0005",
      "s005-b0006",
      "s005-b0007",
      "s005-b0008",
      "s005-b0009",
      "s005-b0010",
      "s005-b0011",
      "s005-b0012"
    ],
    "unreviewed": []
  },
  "findings": [
    {
      "id": "F-001",
      "kind": "missing",
      "title": "Структура шаблона не сохранена явно",
      "problem": "Во всех трёх примерах отсутствуют отдельные разделы шаблона, при этом документ не помечает их как «не применимо». Например, не выделены Data Catalog, источники обогащения, пример данных, DDL и история изменений; состав пропусков различается между примерами.",
      "reason": "По предоставленному чек-листу все разделы шаблона должны сохраняться, а неприменимые этапы — маркироваться. Иначе читатель не отличает осознанное отсутствие от незаполненного требования.",
      "question": "Какие отсутствующие разделы нужно восстановить в каждом из трёх примеров, а какие явно отметить «не применимо»?",
      "priority": "medium",
      "priority_reason": "Пробел затрудняет контроль полноты, но часть разделов может быть неприменима и не обязательно меняет расчёт.",
      "status": "unreviewed",
      "human_review": null,
      "anchors": [],
      "scope": [
        "s001-p0002-text",
        "s001-p0003-text",
        "s001-p0004-text",
        "s001-p0005-text",
        "s001-p0006-text",
        "s001-p0007-text",
        "s001-p0008-text",
        "s001-p0009-text"
      ]
    },
    {
      "id": "F-002",
      "kind": "inconsistency",
      "title": "Расположение источников и инфраструктурные параметры не определены",
      "problem": "В потоке геолокации перечислены топики без Kafka-кластера и ссылок на каталог; в CDR-примере HDFS-адрес свёрнут до значения «Папка»; в витрине перечислены таблицы без прямых ссылок на Data Catalog.",
      "reason": "Предоставленный чек-лист требует Kafka-кластер, прямую ссылку на Data Catalog и полный HDFS-путь с форматом. Без этих реквизитов разработчик не может однозначно найти физические источники и приёмники. Поскольку документы обезличены, требуется отделить заменённые значения от отсутствующей структуры.",
      "question": "Какие поля формы должны содержать Kafka-кластер, прямые ссылки на Data Catalog и полные HDFS-пути, и какие текущие заглушки действительно заменяют эти значения при обезличивании?",
      "priority": "high",
      "priority_reason": "Неоднозначное физическое расположение блокирует подключение источников и проверку маршрута данных.",
      "status": "unreviewed",
      "human_review": null,
      "anchors": [
        {
          "source_id": "s001",
          "fragment_id": "s001-p0003-text",
          "quote": "PROVIDER_GEO → Kafka (24 часа хранения)"
        },
        {
          "source_id": "s001",
          "fragment_id": "s001-p0005-t001-r002",
          "quote": "Центр | TOPIC_MSCP_CDR_CENTRAL | Папка"
        },
        {
          "source_id": "s001",
          "fragment_id": "s001-p0007-t001-r002",
          "quote": "SCHEMA_RAW | TABLE_IUM_RAW_PS"
        },
        {
          "source_id": "s002",
          "fragment_id": "s002-p0001-text",
          "quote": "обязательно указывается кластер Kafka"
        }
      ],
      "scope": []
    },
    {
      "id": "F-003",
      "kind": "missing",
      "title": "Нет полной спецификации сериализации входов и выходов",
      "problem": "Для Kafka-потоков и большинства приёмников не задана модель сообщения: формат, схема, способ сериализации и десериализации. В CDR-примере указаны CSV/gzip и ORC только для отдельных участков, но не описано, как одна входная модель отображается в Kafka и два RAW-приёмника.",
      "reason": "Без модели входного и выходного потока нельзя проверить совместимость producer/consumer, эволюцию схемы и корректность преобразования форматов.",
      "question": "Каковы формат, версия схемы и сериализация/десериализация для каждого Kafka-топика и приёмника, включая переход CSV/gzip → Kafka → ORC/CSV?",
      "priority": "high",
      "priority_reason": "Несогласованная схема сообщения может сделать поток технически несовместимым уже на границе систем.",
      "status": "unreviewed",
      "human_review": null,
      "anchors": [],
      "scope": [
        "s001-p0003-text",
        "s001-p0005-text",
        "s001-p0006-text",
        "s001-p0007-text"
      ]
    },
    {
      "id": "F-004",
      "kind": "missing",
      "title": "Для полей витрин не указана обязательность",
      "problem": "Структура TABLE_AGG_DEVICES содержит имя, тип и описание пяти выходных полей, но не фиксирует NOT NULL/NULLABLE и поведение при неизвестном регионе, неизвестном вендоре или отсутствии подходящего IMEI.",